<xs:schema attributeFormDefault="unqualified" elementFormDefault="qualified" xmlns:xs="http://www.w3.org/2001/XMLSchema">
  <xs:element name="Assets">
    <xs:annotation>
      <xs:documentation>&lt;Assets xmlns:xsi="http://www.w3.org/2001/XMLSchema-instance"
	xsi:noNamespaceSchemaLocation="Assets.xsd"></xs:documentation>
    </xs:annotation>
    <xs:complexType>
      <xs:sequence>
        <xs:element name="Asset" maxOccurs="unbounded" minOccurs="0">
          <xs:complexType>
            <xs:sequence>
              <xs:element type="xs:string" name="Name"/>
              <xs:element type="xs:string" name="Type"/>
              <xs:element type="xs:byte" name="Size"/>
              <xs:element name="Location">
                <xs:complexType>
                  <xs:simpleContent>
                    <xs:extension base="xs:string">
                      <xs:attribute type="xs:byte" name="x" use="optional"/>
                      <xs:attribute type="xs:byte" name="y" use="optional"/>
                    </xs:extension>
                  </xs:simpleContent>
                </xs:complexType>
              </xs:element>
              <xs:element type="xs:byte" name="CostPerNight"/>
              <xs:element name="AssetContents">
                <xs:complexType>
                  <xs:sequence>
                    <xs:element name="AssetContent" maxOccurs="unbounded" minOccurs="0">
                      <xs:complexType>
                        <xs:sequence>
                          <xs:element type="xs:string" name="Name"/>
                          <xs:element type="xs:float" name="RepairMultiplier"/>
                        </xs:sequence>
                      </xs:complexType>
                    </xs:element>
                  </xs:sequence>
                </xs:complexType>
              </xs:element>
            </xs:sequence>
          </xs:complexType>
        </xs:element>
      </xs:sequence>
    </xs:complexType>
  </xs:element>
</xs:schema>